<?xml version="1.0" encoding="UTF-8"?>
<equipos_de_futbol xmlns:xsi="http://www.w3.org/2001/XMLSchema-instance" xsi:noNamespaceSchemaLocation="file:///C:/IFCD0210/MF0491-3%20cliente/UF1841/E2/altovapractica1.xsd">
	<equipo>
		<nombre>Tenerife</nombre>
		<ciudad>S7c de Tenerife</ciudad>
		<entrenador/>
		<jugadores>
			<jugador posicion="portero">
				<nombre>Dani Hernandez</nombre>
				<nacionalidad>española</nacionalidad>
			</jugador>
			<jugador posicion="delantero">
				<nombre>Fernando Coniglio</nombre>
				<nacionalidad>argentino</nacionalidad>
			</jugador>
		</jugadores>
	</equipo>
	<equipo>
		<nombre>Las Palmas</nombre>
		<ciudad>Las Palmas de Gran Canaria</ciudad>
		<entrenador/>
		<jugadores>
			<jugador posicion="portero">
				<nombre>Raúl Fernández-Cavada</nombre>
				<nacionalidad>española</nacionalidad>
			</jugador>
			<jugador posicion="delantero">
				<nombre>Rafa Mir</nombre>
				<nacionalidad>española</nacionalidad>
			</jugador>
		</jugadores>
	</equipo>
</equipos_de_futbol>
